{
  "id": 6,
  "$created": "1970-01-01T00:00:00.000Z",
  "$updated": "1970-01-01T00:00:00.000Z",
  "emailName": null,
  "domain": null,
  "googleAnalyticsID": null,
  "path": "person",
  "visibility": "public",
  "template": true,
  "locked": "unlocked",
  "hasIcon": false,
  "hasMaskableIcon": false,
  "iconBackground": "#ffffff",
  "iconUrl": null,
  "definition": {
    "name": "Person",
    "description": "A simple form and data viewing app using the resource API",
    "defaultPage": "Person Registration Form",
    "security": {
      "guest": {
        "permissions": [
          "$resource:person:create",
          "$resource:person:update",
          "$resource:person:patch",
          "$resource:person:query",
          "$resource:person:get",
          "$resource:person:delete"
        ]
      }
    },
    "resources": {
      "person": {
        "schema": {
          "type": "object",
          "additionalProperties": false,
          "required": ["firstName", "lastName", "email"],
          "properties": {
            "firstName": { "type": "string" },
            "lastName": { "type": "string" },
            "email": { "type": "string", "format": "email" },
            "description": { "type": "string" },
            "picture": { "type": "string", "format": "binary" }
          }
        }
      }
    },
    "pages": [
      {
        "name": "Person List",
        "blocks": [
          {
            "type": "data-loader",
            "version": "0.30.14-test.7",
            "actions": { "onLoad": { "type": "resource.query", "resource": "person" } },
            "events": { "emit": { "data": "data" } }
          },
          {
            "type": "table",
            "version": "0.30.14-test.7",
            "parameters": {
              "fields": [
                { "value": { "prop": "firstName" }, "label": "First Name" },
                { "value": { "prop": "lastName" }, "label": "Surname" }
              ]
            },
            "actions": { "onClick": { "to": "Person Details", "type": "link" } },
            "events": { "listen": { "data": "data" } }
          },
          {
            "type": "action-button",
            "version": "0.30.14-test.7",
            "parameters": { "icon": "plus" },
            "actions": { "onClick": { "to": "Person Registration Form", "type": "link" } }
          }
        ]
      },
      {
        "name": "Person Registration Form",
        "blocks": [
          {
            "type": "form",
            "version": "0.30.14-test.7",
            "actions": {
              "onSubmit": {
                "type": "resource.create",
                "resource": "person",
                "remapBefore": { "null.strip": null },
                "onSuccess": { "type": "link", "to": "Person List" }
              }
            },
            "parameters": {
              "fields": [
                {
                  "label": { "translate": "firstName" },
                  "name": "firstName",
                  "type": "string",
                  "requirements": [{ "required": true }]
                },
                {
                  "label": { "translate": "lastName" },
                  "name": "lastName",
                  "type": "string",
                  "requirements": [{ "required": true }]
                },
                {
                  "label": { "translate": "email" },
                  "name": "email",
                  "type": "string",
                  "requirements": [{ "required": true }]
                },
                {
                  "label": { "translate": "description" },
                  "multiline": true,
                  "name": "description",
                  "type": "string"
                },
                { "label": { "translate": "picture" }, "name": "picture", "type": "file" }
              ]
            }
          }
        ]
      },
      {
        "name": "Person Details",
        "parameters": ["id"],
        "blocks": [
          {
            "type": "data-loader",
            "version": "0.30.14-test.7",
            "actions": { "onLoad": { "type": "resource.get", "resource": "person" } },
            "events": { "emit": { "data": "data" } }
          },
          {
            "type": "detail-viewer",
            "version": "0.30.14-test.7",
            "parameters": {
              "fields": [
                { "value": { "prop": "firstName" }, "label": { "translate": "firstName" } },
                { "value": { "prop": "lastName" }, "label": { "translate": "lastName" } },
                { "value": { "prop": "email" }, "label": { "translate": "email" } },
                { "value": { "prop": "description" }, "label": { "translate": "description" } },
                {
                  "value": { "prop": "picture" },
                  "label": { "translate": "picture" },
                  "type": "file"
                }
              ]
            },
            "events": { "listen": { "data": "data" } }
          }
        ]
      }
    ]
  },
  "yaml": "name: Person\r\ndescription: A simple form and data viewing app using the resource API\r\ndefaultPage: Person Registration Form\r\n\r\nsecurity:\r\n  guest:\r\n    permissions:\r\n      - $resource:person:create\r\n      - $resource:person:update\r\n      - $resource:person:patch\r\n      - $resource:person:query\r\n      - $resource:person:get\r\n      - $resource:person:delete\r\n\r\nresources:\r\n  person:\r\n    schema:\r\n      type: object\r\n      additionalProperties: false\r\n      required:\r\n        - firstName\r\n        - lastName\r\n        - email\r\n      properties:\r\n        firstName:\r\n          type: string\r\n        lastName:\r\n          type: string\r\n        email:\r\n          type: string\r\n          format: email\r\n        description:\r\n          type: string\r\n        picture:\r\n          type: string\r\n          format: binary\r\n\r\npages:\r\n  - name: Person List\r\n    blocks:\r\n      - type: data-loader\r\n        version: 0.30.14-test.7\r\n        actions:\r\n          onLoad:\r\n            type: resource.query\r\n            resource: person\r\n        events:\r\n          emit:\r\n            data: data\r\n      - type: table\r\n        version: 0.30.14-test.7\r\n        parameters:\r\n          fields:\r\n            - value: { prop: firstName }\r\n              label: First Name\r\n            - value: { prop: lastName }\r\n              label: Surname\r\n        actions:\r\n          onClick:\r\n            to: Person Details\r\n            type: link\r\n        events:\r\n          listen:\r\n            data: data\r\n      - type: action-button\r\n        version: 0.30.14-test.7\r\n        parameters:\r\n          icon: plus\r\n        actions:\r\n          onClick:\r\n            to: Person Registration Form\r\n            type: link\r\n\r\n  - name: Person Registration Form\r\n    blocks:\r\n      - type: form\r\n        version: 0.30.14-test.7\r\n        actions:\r\n          onSubmit:\r\n            type: resource.create\r\n            resource: person\r\n            remapBefore: { null.strip }\r\n            onSuccess:\r\n              type: link\r\n              to: Person List\r\n        parameters:\r\n          fields:\r\n            - label: { translate: firstName }\r\n              name: firstName\r\n              type: string\r\n              requirements: [{ required: true }]\r\n            - label: { translate: lastName }\r\n              name: lastName\r\n              type: string\r\n              requirements: [{ required: true }]\r\n            - label: { translate: email }\r\n              name: email\r\n              type: string\r\n              requirements: [{ required: true }]\r\n            - label: { translate: description }\r\n              multiline: true\r\n              name: description\r\n              type: string\r\n            - label: { translate: picture }\r\n              name: picture\r\n              type: file\r\n\r\n  - name: Person Details\r\n    parameters:\r\n      - id\r\n    blocks:\r\n      - type: data-loader\r\n        version: 0.30.14-test.7\r\n        actions:\r\n          onLoad:\r\n            type: resource.get\r\n            resource: person\r\n        events:\r\n          emit:\r\n            data: data\r\n      - type: detail-viewer\r\n        version: 0.30.14-test.7\r\n        parameters:\r\n          fields:\r\n            - value: { prop: firstName }\r\n              label: { translate: firstName }\r\n            - value: { prop: lastName }\r\n              label: { translate: lastName }\r\n            - value: { prop: email }\r\n              label: { translate: email }\r\n            - value: { prop: description }\r\n              label: { translate: description }\r\n            - value: { prop: picture }\r\n              label: { translate: picture }\r\n              type: file\r\n        events:\r\n          listen:\r\n            data: data\r\n",
  "showAppDefinition": true,
  "sentryDsn": null,
  "sentryEnvironment": null,
  "showAppsembleLogin": false,
  "showAppsembleOAuth2Login": true,
  "enableSelfRegistration": true,
  "enableUnsecuredServiceSecrets": false,
  "displayAppMemberName": false,
  "OrganizationId": "appsemble",
  "OrganizationName": "Appsemble",
  "screenshotUrls": [
    "/api/apps/6/screenshots/9",
    "/api/apps/6/screenshots/10",
    "/api/apps/6/screenshots/11"
  ],
  "readmeUrl": "/api/apps/6/readmes/7",
  "demoMode": false,
  "controllerCode": null,
  "controllerImplementations": null
}
